{
  "$schema": "../component.schema.json",
  "name":    "AppShell",
  "version": "1.0.0",
  "status":  "beta",

  "purpose": "The top-level page shell — composes a SideNav, a TopBar, and the scrollable main content into one consistent full-height layout. Never write `display: flex; min-height: 100vh` by hand again.",
  "import": "import { AppShell } from '@helixds/react';",

  "neverUseFor": [
    "A single content section inside an already-shelled page — AppShell is used once, at the page root",
    "Auth/marketing pages with no persistent nav — a page with no SideNav should just render its content directly, not force an empty shell"
  ],

  "rationale": "AppShell exists so no page hand-writes `display: flex; min-height: 100vh` again: it fixes one composition of SideNav, TopBar and a single scrollable <main>, which guarantees exactly one main landmark per page (WCAG 2.4.1 Bypass Blocks) and a consistent scroll container across every product screen.",

  "governance": {
    "mayExtendLocally": [
      "Choose which SideNav entries and TopBar actions a product renders",
      "Compose any page content inside the main slot",
      "Omit the shell entirely on auth/marketing pages with no persistent nav"
    ],
    "mustEscalateToDS": [
      "Adding new shell regions (e.g. a right rail or a footer bar)",
      "Changing which element scrolls or rendering more than one <main>",
      "Nesting AppShell inside another layout or page"
    ]
  },

  "states": {
    "intrinsic": [],
    "authored": []
  },

  "anatomy": [
    { "part": "app-shell-root",    "element": "div",  "description": "Root — full-viewport-height flex row." },
    { "part": "app-shell-content", "element": "div",  "description": "Flex column beside the sidenav — wraps the topbar and main." },
    { "part": "app-shell-main",    "element": "main", "description": "Scrollable main content region." }
  ],

  "props": [
    { "name": "sidenav",  "type": "React.ReactNode | undefined", "description": "A SideNav instance, rendered to the left." },
    { "name": "topbar",   "type": "React.ReactNode | undefined", "description": "A TopBar instance, rendered above the main content." },
    { "name": "children", "type": "React.ReactNode", "required": true, "description": "The page's main content." },
    { "name": "className", "type": "string | undefined", "description": "Additional className for the root." }
  ],

  "tokenPolicy": {
    "allowed":   ["color.fill"],
    "forbidden": ["primitive.color"]
  },

  "a11y": {
    "role": "main (implicit from <main> on app-shell-main — exactly one per page)",
    "wcag": ["1.3.1 Info and Relationships", "2.4.1 Bypass Blocks"],
    "results": {
      "score": 100,
      "meetsMinimum": true,
      "checks": {
        "contract": "pass",
        "keys": "n/a",
        "focus-return": "n/a",
        "keyboard": "n/a",
        "axe": "pass",
        "contrast": "pass",
        "focus-visible": "pass",
        "target-size": "pass",
        "reflow": "pass",
        "screen-reader": "pass",
        "ai-visual": "fail",
        "human": "pending"
      },
      "notScored": [
        "ai-visual",
        "human"
      ],
      "changed": "2026-10-12"
    }
  },

  "figma": {
    "states": ["default"],
    "properties": [],
    "structure": "No variants or props of its own — app-shell-root (fill/page) > SideNav instance + app-shell-content (TopBar instance + app-shell-main, 24px padding = spacing/l). Main holds sample content (PageHeader + Card instances)."
  }
}
