{
  "$schema": "../component.schema.json",
  "name":    "StatCard",
  "version": "1.0.0",
  "status":  "stable",

  "purpose": "Displays a single key metric — a label, a large value, and an optional trend delta — for dashboard KPI rows.",

  "neverUseFor": [
    "Multi-metric comparisons in one tile — use a Table or chart instead",
    "Interactive/clickable metrics that navigate elsewhere — if it needs a click target, compose a Button around it explicitly rather than making the whole card implicitly clickable",
    "Real-time streaming values without a static fallback — StatCard has no built-in loading/skeleton state in v1"
  ],

  "states": {
    "intrinsic": [],
    "authored": []
  },

  "anatomy": [
    { "part": "stat-card",             "element": "slot", "description": "Composes Card internally — StatCard is not its own elevated surface, it reuses Card's fill/border/radius/shadow." },
    { "part": "stat-card-label",       "element": "div",  "description": "Small uppercase metric name." },
    { "part": "stat-card-value",       "element": "div",  "description": "The large primary number/value." },
    { "part": "stat-card-delta",       "element": "div",  "description": "Trend row — icon + delta text.", "optional": true },
    { "part": "stat-card-delta-icon",  "element": "slot", "description": "Up/down trend arrow, rendered via Icon.", "optional": true }
  ],

  "props": [
    { "name": "label", "type": "string", "required": true, "description": "The metric's name, e.g. 'Members'." },
    { "name": "value", "type": "string", "required": true, "description": "The metric's value, already formatted by the consumer, e.g. '103', '89%'." },
    { "name": "delta", "type": "string | undefined", "description": "Change text shown next to the trend icon, e.g. '+2 vs last month'." },
    { "name": "trend", "type": "'up' | 'down' | undefined", "description": "Direction of the delta — controls the icon (arrow up/down) and its semantic color (success/danger). Omit to render delta as plain text with no icon." },
    { "name": "className", "type": "string | undefined", "description": "Additional className for the root." }
  ],

  "tokenPolicy": {
    "allowed":   ["color.text", "color.icon", "fontSize", "fontWeight"],
    "forbidden": ["primitive.color"]
  },

  "a11y": {
    "role": "group (implicit)",
    "wcag": ["1.4.1 Use of Color (trend must also be conveyed by the arrow direction and +/- sign in delta text, never color alone)"]
  }
}
