{
  "$schema": "../component.schema.json",
  "name":    "TopBar",
  "version": "1.0.0",
  "status":  "beta",

  "purpose": "The fixed-height chrome bar at the top of a page — search, quick actions, and the current user, always in the same place.",
  "import": "import { TopBar } from '@helixds/react';",

  "neverUseFor": [
    "The page title — use PageHeader inside the main content area instead",
    "Primary navigation — use SideNav; TopBar hosts secondary/global actions, not the nav itself",
    "Scrollable content — TopBar is fixed chrome, never part of the scrolling main area"
  ],

  "rationale": "TopBar is fixed chrome at 56px — past the ADR-004 control scale's 48px top rung, so it aliases the next primitive rung and is documented in component-token-exceptions.md. It hosts search, global actions and the current user, never the page title or the primary navigation.",

  "governance": {
    "mayExtendLocally": [
      "Choose the search, quick actions and user menu content",
      "Compose Helix IconButtons and Avatars in its slots"
    ],
    "mustEscalateToDS": [
      "Changing the 56px height or making it scroll",
      "Moving primary navigation or the page title into TopBar",
      "Adding new regions or background tokens"
    ]
  },

  "states": {
    "intrinsic": [],
    "authored": []
  },

  "anatomy": [
    { "part": "topbar-root",  "element": "header", "description": "Root — always a native <header>, fixed height." },
    { "part": "topbar-start", "element": "div",    "description": "Leading slot — typically a search Input.", "optional": true },
    { "part": "topbar-end",   "element": "div",    "description": "Trailing slot — typically IconButtons (notifications, help, quick actions). The current user lives in SideNav's footer, not here.", "optional": true }
  ],

  "props": [
    { "name": "start", "type": "React.ReactNode | undefined", "description": "Leading slot content." },
    { "name": "end",   "type": "React.ReactNode | undefined", "description": "Trailing slot content." },
    { "name": "className", "type": "string | undefined", "description": "Additional className for the root." }
  ],

  "sizing": {
    "height": {
      "mode": "fixed",
      "values": { "default": 56 },
      "unit": "px",
      "note": "Past ADR-004's Control scale top rung (xl=48px) — aliases the next primitive rung up (primitive.size.350), documented in component-token-exceptions.md."
    }
  },

  "tokenPolicy": {
    "allowed":   ["color.fill", "color.border", "spacing"],
    "forbidden": ["primitive.color"]
  },

  "a11y": {
    "role": "banner (implicit from <header>, when it's a direct child of <body> in the real page — not automatic inside Storybook's iframe)",
    "wcag": ["1.3.1 Info and Relationships"]
  },

  "figma": {
    "states": ["default"],
    "properties": [
      { "name": "start", "type": "BOOLEAN", "codeProp": "start", "description": "Show/hide the start slot (search Input, size m; the slot is capped at 320px like max-width in code)." },
      { "name": "end", "type": "BOOLEAN", "codeProp": "end", "description": "Show/hide the end slot (ghost IconButtons, size m, 4px apart). The slots sit at both ends (SPACE_BETWEEN = margin-left: auto)." }
    ],
    "structure": "No variants — a single component. Every control in the row is size m (same-row-sizing.md)."
  }
}
