{
  "$schema": "../component.schema.json",
  "name":    "Table",
  "version": "1.0.0",
  "status":  "stable",

  "purpose": "Displays tabular data edge-to-edge — rows and columns of related records, e.g. a member list, a billing history.",

  "neverUseFor": [
    "A single record's key/value details — use a description list pattern instead",
    "Card-wrapped individual rows — Table rows are edge-to-edge by design, never wrap one row in a Card",
    "Non-tabular free-form content — Table is for genuinely row/column data, not a generic layout grid"
  ],

  "rationale": "Table renders native <table> tags to ensure tabular WCAG accessibility semantics (th scope, caption, tr/td navigation). Rows expand 100% edge-to-edge inside their parent container.",

  "governance": {
    "mayExtendLocally": [
      "Compose custom cell renderers using Helix Badge, Avatar, or IconButton",
      "Implement client-side or server-side pagination controls below the Table"
    ],
    "mustEscalateToDS": [
      "Modifying internal row padding or border tokens",
      "Replacing native HTML <table> with flex/grid div rows"
    ]
  },

  "states": {
    "intrinsic": ["hover (row)"],
    "authored": []
  },

  "anatomy": [
    { "part": "table",             "element": "table",  "description": "Root — always a native <table>, always 100% width of its container." },
    { "part": "table-head",        "element": "thead",  "description": "Wraps the header row(s)." },
    { "part": "table-body",        "element": "tbody",  "description": "Wraps the data rows." },
    { "part": "table-row",         "element": "tr",     "description": "One row. Hover is CSS-only (:hover), never a JS mouseenter/mouseleave handler." },
    { "part": "table-header-cell", "element": "th",     "description": "One column header cell." },
    { "part": "table-cell",        "element": "td",     "description": "One data cell — content is fully consumer-controlled (text, Badge, Avatar, Button, ...)." }
  ],

  "props": [
    { "name": "children",  "type": "React.ReactNode", "required": true, "description": "Table content — typically a TableHead and a TableBody." },
    { "name": "className", "type": "string | undefined", "description": "Additional className for the root <table>." }
  ],

  "tokenPolicy": {
    "allowed":   ["color.fill", "color.text", "color.border", "spacing", "fontSize", "fontWeight"],
    "forbidden": ["primitive.color"]
  },

  "a11y": {
    "role": "table (implicit — native <table>/<thead>/<tbody>/<tr>/<th>/<td> already carries full table semantics, nothing hand-rolled)",
    "wcag": ["1.3.1 Info and Relationships"]
  },

  "figma": {
    "states": ["default", "hover"],
    "properties": [
      { "name": "state", "type": "VARIANT", "values": ["default", "hover"], "figmaOnly": true, "description": "On the TableRow set only — :hover in code fills the body row with fill/secondary/interactive/default." },
      { "name": "label", "type": "TEXT", "codeProp": "children", "description": "TableHeaderCell's text (Label / Uppercase, uppercased + letterSpacing wide at the call site)." },
      { "name": "content", "type": "TEXT", "codeProp": "children", "description": "TableCell's text (Body / s / Regular)." }
    ],
    "structure": "Three building blocks — TableHeaderCell, TableCell (components) and TableRow (set: state) — composed into a static Table component. The last body row's instance drops its bottom stroke, like `:last-child { border-bottom: none }` in code."
  }
}
