{
  "$schema": "../component.schema.json",
  "name":    "SideNav",
  "version": "1.0.0",
  "status":  "stable",

  "purpose": "The persistent vertical navigation rail of an app shell — brand mark, primary nav entries, and a footer slot for the current user.",
  "import": "import { SideNav } from '@helixds/react';",

  "neverUseFor": [
    "In-page tabbed navigation — use Tabs",
    "Breadcrumbs — SideNav is persistent app-level nav, breadcrumbs are per-page wayfinding",
    "Anything other than NavItem as its direct nav entries — don't put a Button or a plain <a> among the items"
  ],

  "rationale": "SideNav is the persistent <nav> rail of the app shell with a fixed 224px chrome width — a standalone dimension documented in component-token-exceptions.md. It accepts only NavItems as entries so every app's navigation shares the same link semantics and active styling.",

  "governance": {
    "mayExtendLocally": [
      "Choose the brand mark, NavItems and footer content",
      "Group NavItems into product-specific sections"
    ],
    "mustEscalateToDS": [
      "Changing the 224px width or adding a collapsed/mini mode",
      "Putting Buttons or plain links among the nav entries",
      "Adding nested multi-level navigation"
    ]
  },

  "states": {
    "intrinsic": [],
    "authored": []
  },

  "anatomy": [
    { "part": "side-nav-root",   "element": "nav", "description": "Root — always a native <nav>, fixed width." },
    { "part": "side-nav-brand",  "element": "div", "description": "Logo/product-name slot at the top.", "optional": true },
    { "part": "side-nav-items",  "element": "div", "description": "Wraps the NavItem list (children)." },
    { "part": "side-nav-footer", "element": "div", "description": "Slot at the bottom — typically the current user row.", "optional": true }
  ],

  "props": [
    { "name": "brand",    "type": "React.ReactNode | undefined", "description": "Logo/product-name content, rendered at the top." },
    { "name": "children", "type": "React.ReactNode", "required": true, "description": "The nav entries — a list of NavItem." },
    { "name": "footer",   "type": "React.ReactNode | undefined", "description": "Content pinned to the bottom — typically the current user." },
    { "name": "className", "type": "string | undefined", "description": "Additional className for the root." }
  ],

  "sizing": {
    "width": {
      "default": "fixed",
      "note": "224px, a standalone chrome dimension — no matching primitive/spacing/size rung, documented in component-token-exceptions.md."
    }
  },

  "tokenPolicy": {
    "allowed":   ["color.fill", "color.border", "spacing"],
    "forbidden": ["primitive.color"]
  },

  "a11y": {
    "role": "navigation (implicit from <nav>)",
    "wcag": ["1.3.1 Info and Relationships", "2.4.1 Bypass Blocks"],
    "applied": {
      "nativeElement": "nav",
      "innerComponents": [
        "NavItem"
      ],
      "focus": [
        {
          "part": "(its inner controls)",
          "delegatedTo": [
            "NavItem"
          ],
          "note": "focus is drawn by NavItem — see their a11y.applied.focus"
        }
      ],
      "aria": {},
      "announced": [
        "navigation"
      ],
      "contrast": {
        "side-nav-brand": {
          "light": "17.85:1 — #0f172a on #ffffff",
          "dark": "16.29:1 — #f1f5f9 on #0f172a"
        },
        "side-nav-footer": {
          "light": "4.75:1 — #64748b on #ffffff",
          "dark": "6.96:1 — #94a3b8 on #0f172a"
        },
        "side-nav-brand (icon)": {
          "light": "16.4:1 — #0f172a on #eff6ff",
          "dark": "9.45:1 — #f1f5f9 on #1e3a8a"
        }
      },
      "targetSize": {},
      "motion": [
        "CSS transitions/animations: neutralised by the global prefers-reduced-motion rule"
      ]
    },
    "results": {
      "score": 100,
      "meetsMinimum": true,
      "checks": {
        "contract": "pass",
        "keys": "n/a",
        "focus-return": "n/a",
        "keyboard": "n/a",
        "axe": "pass",
        "contrast": "pass",
        "focus-visible": "pass",
        "target-size": "pass",
        "reflow": "pass",
        "screen-reader": "pass",
        "ai-visual": "pass",
        "human": "pending"
      },
      "notScored": [
        "ai-visual",
        "human"
      ],
      "changed": "2026-10-12"
    }
  },

  "figma": {
    "childProps": {"children": [{"component": "NavItem", "property": "label", "note": "each link"}]},
    "states": ["default"],
    "properties": [
      { "name": "brand", "type": "BOOLEAN", "codeProp": "brand", "description": "Show/hide part: the brand row carries its own 12px bottom (code's margin-bottom), so hiding it leaves the items where the root's 12px top puts them." },
      { "name": "footer", "type": "BOOLEAN", "codeProp": "footer", "description": "Show/hide part: 8px margin + top border + 8px padding all live on the footer." }
    ],
    "structure": "No variants — a single component: side-nav-brand > brand-content, side-nav-items (NavItem instances, fills the height), side-nav-footer > footer-content (Avatar instance + name/role).",
    "stories": {
      "Default": "brand=true, footer=true"
    }
  }
}
